Question,Answer
"What is ‘algae farm’ insurance?","Covers spirulina/chlorella growers for bioreactors."
"What is ‘biofloc’ insurance?","For high-density fish/shrimp farming systems."
"What is ‘hatchery’ insurance?","Covers fish/poultry egg incubation facilities."
"What is ‘feedlot’ insurance?","Protects cattle finishing operations against disease."
"What is ‘dairy parlor’ insurance?","Covers milking equipment breakdowns or contamination."
"What is ‘poultry layer’ insurance?","For egg-producing hen farms against avian flu."
"What is ‘broiler chicken’ insurance?","Covers meat-bird growers against price fluctuations."
"What is ‘quail egg’ insurance?","Specialty coverage for high-value petite egg producers."
"What is ‘ostrich egg’ insurance?","Protects valuable incubation investments."
"What is ‘caviar farm’ insurance?","High-premium coverage for sturgeon roe operations."
"What is ‘frog leg’ insurance?","For bullfrog farms supplying gourmet restaurants."
"What is ‘snail caviar’ insurance?","Covers rare escargot roe producers."
"What is ‘edible insect’ insurance?","Emerging market for cricket/mealworm protein farms."
"What is ‘silk farm’ insurance?","Protects mulberry-fed silkworm cocoon harvests."
"What is ‘lac insect’ insurance?","For shellac-producing beetle resin farms."
"What is ‘cochineal’ insurance?","Covers dye-producing cactus scale insect farms."
"What is ‘pearl farm’ insurance?","Protects oyster/mussel aquaculture for gem production."
"What is ‘coral jewelry’ insurance?","For sustainable harvested coral crafters."
"What is ‘sea cucumber’ insurance?","Covers high-value bêche-de-mer (dried seafood) farms."
"What is ‘abalone’ insurance?","Protects gourmet mollusk farms against poaching."
"What is ‘geoduck’ insurance?","For giant clam farmers in the Pacific Northwest."
"What is ‘lobster farm’ insurance?","Covers spiny lobster aquaculture operations."
"What is ‘eel farm’ insurance?","Protects unagi growers (high mortality risk)."
"What is ‘octopus farm’ insurance?","Controversial coverage for intelligent cephalopod cultivation."
"What is ‘jellyfish farm’ insurance?","For aquarium/exotic food markets."
"What is ‘krill oil’ insurance?","Covers Antarctic shrimp harvesting for supplements."
"What is ‘plankton farm’ insurance?","For microalgae producers (e.g., omega-3 supplements)."
"What is ‘seaweed snack’ insurance?","Protects nori/kelp growers for culinary uses."
"What is ‘fish meal’ insurance?","For anchovy/sardine processors (animal feed industry)."
"What is ‘aquarium trade’ insurance?","Covers tropical fish breeders for ornamental markets."
"What is ‘live rock’ insurance?","Protects coral rubble harvesters for saltwater tanks."
"What is ‘aquascaping’ insurance?","For underwater garden designers’ liability."
"What is ‘koi pond’ insurance?","High-value coverage for ornamental carp collectors."
"What is ‘fisheries’ insurance?","Combined hull, catch, and liability for commercial boats."
"What is ‘oyster reef’ insurance?","For restoration projects mitigating storm surges."
"What is ‘mangrove’ insurance?","Protects coastal carbon-sequestration plantations."
"What is ‘kelp forest’ insurance?","Covers underwater seaweed farms for carbon credits."
"What is ‘coral reef’ insurance?","Parametric policies for hurricane damage to reefs (e.g., Caribbean)."
"What is ‘bivalve’ insurance?","For clam/oyster growers improving water quality."
"What is ‘fish vaccine’ insurance?","Covers pharmaceutical R&D for aquaculture diseases."
"What is ‘aquatic feed’ insurance?","Protects algae-based fish meal alternative producers."
"What is ‘fishing gear’ insurance?","Covers loss/damage of nets, traps, or lobster pots."
"What is ‘whale watching’ insurance?","Liability for tourist boats near marine mammals."
"What is ‘dive shop’ insurance?","Combines equipment, liability, and accident coverage."
"What is ‘underwater hotel’ insurance?","For Maldives-style submerged accommodations."
"What is ‘mermaid school’ insurance?","Liability for professional mermaid swimming lessons."
"What is ‘shark diving’ insurance?","High-risk coverage for cage-diving operators."
"What is ‘shipwreck tour’ insurance?","Protects scuba excursions to historic wrecks."
"What is ‘underwater welding’ insurance?","High-premium coverage for commercial divers."
"What is ‘submarine’ insurance?","For tourist/research submersibles (excludes military)."
"What is ‘sonar equipment’ insurance?","Covers fish-finding/nautical mapping devices."
"What is ‘fishing drone’ insurance?","For UAVs casting lines or monitoring stocks."
"What is ‘robotic harvester’ insurance?","Protects AI-driven fruit-picking machines."
"What is ‘vertical farming robot’ insurance?","Covers automated indoor agriculture systems."
"What is ‘milking robot’ insurance?","For automated dairy parlors (e.g., Lely Astronaut)."
"What is ‘weed-killing drone’ insurance?","Liability for herbicide-spraying UAVs."
"What is ‘livestock tracking’ insurance?","Covers GPS collars for cattle/sheep."
"What is ‘smart hive’ insurance?","Protects IoT-enabled beehive monitoring systems."
"What is ‘aquaculture sensor’ insurance?","For water-quality monitors in fish farms."
"What is ‘hydroponic AI’ insurance?","Covers machine-learning nutrient dosing systems."
"What is ‘blockchain traceability’ insurance?","For farm-to-table supply chain tech."
"What is ‘ag drone’ insurance?","Covers crop-spraying/mapping unmanned aircraft."
"What is ‘soil sensor’ insurance?","Protects moisture/pH monitoring devices."
"What is ‘frost fan’ insurance?","For wind machines preventing orchard freeze damage."
"What is ‘irrigation pivot’ insurance?","Covers center-pivot sprinkler systems."
"What is ‘greenhouse automation’ insurance?","For climate-control computers in nurseries."
"What is ‘livestock facial recognition’ insurance?","Covers AI that identifies sick animals."
"What is ‘predator deterrent’ insurance?","For drones/lights scaring wolves from sheep."
"What is ‘electric tractor’ insurance?","Protects battery-powered farm vehicles."
"What is ‘ag solar panel’ insurance?","Covers photovoltaic arrays on farmland."
"What is ‘wind turbine’ insurance?","For on-farm renewable energy generators."
"What is ‘biogas digester’ insurance?","Protects manure-to-methane systems."
"What is ‘hydropower turbine’ insurance?","For small-scale farm creek generators."
"What is ‘grain silo’ insurance?","Covers storage facilities against explosions."
"What is ‘cold storage’ insurance?","For fruit/vegetable refrigeration warehouses."
"What is ‘wine cellar’ insurance?","Protects temperature-controlled collections."
"What is ‘cheese cave’ insurance?","Covers artisan aging facilities."
"What is ‘coffee roastery’ insurance?","For fire-prone bean roasting equipment."
"What is ‘chocolate tempering’ insurance?","Protects gourmet confectionery machines."
"What is ‘olive press’ insurance?","Covers artisanal oil extraction equipment."
"What is ‘cider mill’ insurance?","For apple-crushing/pressing operations."
"What is ‘maple evaporator’ insurance?","Protects sap-boiling equipment."
"What is ‘honey extractor’ insurance?","Covers mechanical comb-spinning devices."
"What is ‘mushroom drying’ insurance?","For dehydration equipment (e.g., morels)."
"What is ‘truffle-sniffing dog’ insurance?","Covers trained canines’ veterinary costs."
"What is ‘vineyard drone’ insurance?","For UAVs monitoring grape maturity."
"What is ‘winery barrel’ insurance?","Protects oak casks against leaks/theft."
"What is ‘distillery’ insurance?","Combines fire, equipment, and liquor liability."
"What is ‘brewery vat’ insurance?","Covers fermentation tank failures."
"What is ‘coffee bagging’ insurance?","For packaging equipment (e.g., nitrogen flush)."
"What is ‘tea blending’ insurance?","Protects machinery mixing herbal varieties."
"What is ‘spice grinding’ insurance?","Covers mills producing turmeric/cinnamon."
"What is ‘flour mill’ insurance?","For explosion-prone grain processing."
"What is ‘rice huller’ insurance?","Protects polishing/whitening equipment."
"What is ‘nut sheller’ insurance?","Covers almond/pistachio processing machines."
"What is ‘olive pitter’ insurance?","For devices removing stones from olives."
"What is ‘cherry stoner’ insurance?","Protects pitting equipment for canneries."
"What is ‘apple peeler’ insurance?","Cores/slices fruit for pie fillings."
"What is ‘potato sorter’ insurance?","For optical grading machines."
"What is ‘carrot washer’ insurance?","Covers root vegetable cleaning systems."
"What is ‘lettuce spinner’ insurance?","Protects salad-drying centrifuges."
"What is ‘tomato sorter’ insurance?","For AI-driven ripeness grading belts."
"What is ‘banana ripening’ insurance?","Covers ethylene gas-controlled rooms."
"What is ‘avocado squeezer’ insurance?","For texture-testing robots."
"What is ‘mango grader’ insurance?","Protects size/color sorting machines."
"What is ‘pineapple corer’ insurance?","Automates crown/fruit removal."
"What is ‘blueberry raker’ insurance?","Covers mechanical harvesters."
"What is ‘strawberry picker’ insurance?","For robotic harvesting arms."
"What is ‘grape crusher’ insurance?","Protects destemming equipment."
"What is ‘hop pelletizer’ insurance?","Covers beer ingredient processing."
"What is ‘yeast bank’ insurance?","Protects brewers’ strain collections."
"What is ‘sourdough starter’ insurance?","For theft of prized cultures."
"What is ‘kombucha SCOBY’ insurance?","Covers symbiotic culture containers."
"What is ‘cheese culture’ insurance?","Protects bacterial/ fungal strains."
"What is ‘probiotic’ insurance?","For live microbe supplement production."
"What is ‘vinegar mother’ insurance?","Covers acetobacter cultures."
"What is ‘tempeh starter’ insurance?","For rhizopus mold inoculants."
"What is ‘natto bacteria’ insurance?","Protects bacillus subtilis cultures."
"What is ‘miso koji’ insurance?","Covers aspergillus oryzae mold."
"What is ‘sake yeast’ insurance?","For japanese rice wine strains."
"What is ‘kefir grain’ insurance?","Protects tibetan milk cultures."
"What is ‘yogurt culture’ insurance?","Covers thermophilic bacteria."
"What is ‘buttermilk’ insurance?","For traditional churning operations."
"What is ‘ghee clarification’ insurance?","Protects indian butter oil production."
"What is ‘paneer press’ insurance?","Covers south asian cheese-making."
"What is ‘tofu coagulant’ insurance?","For magnesium chloride/ gypsum supplies."
"What is ‘soy milk’ insurance?","Protects plant-based beverage lines."
"What is ‘almond milk’ insurance?","Covers nut-processing equipment."
"What is ‘oat milk’ insurance?","For european-style emulsion systems."
"What is ‘rice milk’ insurance?","Protects asian beverage production."
"What is ‘coconut milk’ insurance?","Covers tropical pressing operations."
"What is ‘hemp milk’ insurance?","For cannabis seed beverage lines."
"What is ‘pea protein’ insurance?","Protects legume isolate machinery."
"What is ‘quinoa milk’ insurance?","Covers andean grain processing."
"What is ‘spirulina powder’ insurance?","For algae drying/ packaging."
"What is ‘chlorella tablet’ insurance?","Protects supplement pressing."
"What is ‘wheatgrass juicer’ insurance?","Covers cold-press equipment."
"What is ‘barley grass’ insurance?","For powdered superfood production."
"What is ‘moringa leaf’ insurance?","Protects african tree harvesting."
"What is ‘matcha stone’ insurance?","Covers japanese tea grinding."
"What is ‘turmeric press’ insurance?","For indian rhizome processing."
"What is ‘ginger extractor’ insurance?","Protects essential oil distillation."
"What is ‘garlic oil’ insurance?","Covers allicin extraction systems."
"What is ‘onion powder’ insurance?","For dehydration/ milling lines."
"What is ‘vanilla bean’ insurance?","Protects madagascar orchid curing."
"What is ‘cinnamon roll’ insurance?","Covers sri lankan bark processing."
"What is ‘cardamom pod’ insurance?","For guatemalan spice grading."
"What is ‘peppercorn’ insurance?","Protects indonesian berry drying."
"What is ‘saffron thread’ insurance?","Covers iranian crocus harvesting."
"What is ‘truffle shaver’ insurance?","For italian fungus processing."
"What is ‘morel dryer’ insurance?","Protects wild mushroom preservation."
"What is ‘chanterelle’ insurance?","Covers french forest foraging."
"What is ‘shiitake log’ insurance?","For japanese mushroom cultivation."
"What is ‘oyster mushroom’ insurance?","Protects straw-based growing."
"What is ‘enoki’ insurance?","Covers korean needle mushroom farms."
"What is ‘porcini’ insurance?","For italian boletus drying."
"What is ‘black garlic’ insurance?","Protects fermented bulb aging."
"What is ‘kimchi vat’ insurance?","Covers korean fermentation crocks."
"What is ‘sauerkraut’ insurance?","For german cabbage barrel aging."
"What is ‘pickle barrel’ insurance?","Protects brine cucumber storage."
"What is ‘olive brine’ insurance?","Covers mediterranean curing vats."
"What is ‘capocollo’ insurance?","For italian cured pork shoulder."
"What is ‘prosciutto’ insurance?","Protects dry-aged ham legs."
"What is ‘salami cage’ insurance?","Covers fermented sausage drying."
"What is ‘pepperoni’ insurance?","For american spicy sausage production."
"What is ‘chorizo’ insurance?","Protects spanish paprika-marinated links."
"What is ‘nduja’ insurance?","Covers calabrian spreadable salami."
"What is ‘biltong’ insurance?","For south african air-dried meat."
"What is ‘jerky dehydrator’ insurance?","Protects american snack production."
"What is ‘pemmican’ insurance?","Covers native american meat/fat bars."
"What is ‘smoked salmon’ insurance?","For norwegian wood-chip processing."
"What is ‘gravlax’ insurance?","Protects scandinavian cured fish."
"What is ‘bacalao’ insurance?","Covers portuguese salt cod drying."
"What is ‘anchovy barrel’ insurance?","For mediterranean fish curing."
"What is ‘caviar tin’ insurance?","Protects russian sturgeon roe packaging."
"What is ‘uni tray’ insurance?","Covers japanese sea urchin processing."
"What is ‘surimi line’ insurance?","For fake crab stick production."
"What is ‘fish sauce’ insurance?","Protects vietnamese fermentation vats."
"What is ‘shrimp paste’ insurance?","Covers thai kapi sun-drying."
"What is ‘dashi stock’ insurance?","For japanese kelp/bonito broth."
"What is ‘miso vat’ insurance?","Protects soybean fermentation."
"What is ‘doenjang’ insurance?","Covers korean bean paste aging."
"What is ‘gochujang’ insurance?","For korean chili paste production."
"What is ‘doubanjiang’ insurance?","Protects sichuan broad bean paste."
"What is ‘hoisin’ insurance?","Covers chinese sweet bean sauce."
"What is ‘oyster sauce’ insurance?","For cantonese mollusk reduction."
"What is ‘fish ball’ insurance?","Protects hong kong street food."
"What is ‘tofu skin’ insurance?","Covers yuba drying operations."
"What is ‘rice noodle’ insurance?","For vietnamese pho strand production."
"What is ‘udon cutter’ insurance?","Protects japanese wheat noodle lines."
"What is ‘soba stone’ insurance?","Covers buckwheat grinding mills."
"What is ‘ramen press’ insurance?","For instant noodle block molding."
"What is ‘wonton wrapper’ insurance?","Protects shanghai dumpling skins."
"What is ‘gyoza folder’ insurance?","Covers japanese pleating machines."
"What is ‘bao steamer’ insurance?","For cantonese bun proofing."
"What is ‘mantou’ insurance?","Protects northern chinese bread."
"What is ‘mochi pounder’ insurance?","Covers japanese rice cake mallets."
"What is ‘chapati roller’ insurance?","For indian flatbread production."
"What is ‘naan tandoor’ insurance?","Protects clay oven baking."
"What is ‘paratha’ insurance?","Covers pakistani layered dough."
"What is ‘puri fryer’ insurance?","For indian puffed bread vats."
"What is ‘dosa griddle’ insurance?","Protects south indian crepe stations."
"What is ‘idli steamer’ insurance?","Covers fermented rice cake molds."
"What is ‘appam pan’ insurance?","For kerala bowl-shaped pancakes."
"What is ‘puttu’ insurance?","Protects malayali layered rice cakes."
"What is ‘biriyani pot’ insurance?","Covers hyderabadi dum cooking."
"What is ‘korma karahi’ insurance?","For north indian curry woks."
"What is ‘vindaloo’ insurance?","Protects goan portuguese-influenced stew."
"What is ‘butter chicken’ insurance?","Covers punjabi tomato-cream sauce."
"What is ‘tandoori oven’ insurance?","For clay-fired chicken roasting."
"What is ‘seekh kabab’ insurance?","Protects minced meat skewer grills."
"What is ‘chaat cart’ insurance?","Covers street snack vendor liability."
"What is ‘pani puri’ insurance?","For mumbai hollow crisp filling."
"What is ‘bhel puri’ insurance?","Protects puffed rice mixture stalls."
"What is ‘dahi puri’ insurance?","Covers yogurt-topped snack stations."
"What is ‘samosa’ insurance?","For fried pastry triangle production."
"What is ‘kachori’ insurance?","Protects stuffed lentil dumplings."
"What is ‘pakora’ insurance?","Covers vegetable fritter fryers."
"What is ‘vada pav’ insurance?","For mumbai potato slider stands."
"What is ‘pav bhaji’ insurance?","Protects buttered bun/curry combo."
"What is ‘misal pav’ insurance?","Covers maharashtrian sprouted bean dish."
"What is ‘thali’ insurance?","For stainless steel meal platters."
"What is ‘banana leaf’ insurance?","Protects south indian serving surfaces."
"What is ‘lassi churn’ insurance?","Covers yogurt drink blending."
"What is ‘falooda’ insurance?","For rose syrup vermicelli dessert."
"What is ‘kulfi mold’ insurance?","Protects indian ice cream freezing."
"What is ‘gulab jamun’ insurance?","Covers milk-solid dumpling frying."
"What is ‘rasgulla’ insurance?","For bengali syrupy cheese balls."
"What is ‘rasmalai’ insurance?","Protects flattened milk cake soaking."
"What is ‘barfi cutter’ insurance?","Covers condensed milk sweet slicing."
"What is ‘jalebi swirl’ insurance?","For pretzel-shaped syrup soaking."
"What is ‘ladoo roller’ insurance?","Protects spherical sweet molding."
"What is ‘peda press’ insurance?","Covers milk fudge stamping."
"What is ‘sandesh’ insurance?","For bengali paneer sweet shaping."
"What is ‘mysore pak’ insurance?","Protects ghee-chickpea flour bars."
"What is ‘halwa’ insurance?","Covers semolina/pumpkin pudding."
"What is ‘kheer’ insurance?","For rice/milk slow-cooking."
"What is ‘phirni’ insurance?","Protects ground rice dessert setting."
"What is ‘shrikhand’ insurance?","Covers strained yogurt sweetening."
"What is ‘basundi’ insurance?","For reduced milk raisin/nut dessert."
"What is ‘malpua’ insurance?","Protects fried pancake syrup dipping."
"What is ‘balushahi’ insurance?","Covers glazed doughnut-like sweets."
"What is ‘sohan papdi’ insurance?","For flaky gram flour diamond cuts."
"What is ‘chikki’ insurance?","Protects peanut/jaggery brittle."
"What is ‘revdi’ insurance?","Covers sesame seed candy sheets."
"What is ‘til laddoo’ insurance?","For winter sesame/jaggery balls."
"What is ‘gond katira’ insurance?","Protects edible gum dessert prep."
"What is ‘khorak’ insurance?","Covers dried fruit/nut trail mixes."
"What is ‘pan masala’ insurance?","For betel nut-based mouth freshener."
"What is ‘supari’ insurance?","Protects areca nut processing."
"What is ‘paan leaf’ insurance?","Covers betel leaf wrapping."
"What is ‘mithai’ insurance?","For indian sweet shop liability."
"What is ‘namkeen’ insurance?","Protects savory snack production."
"What is ‘bhujia’ insurance?","Covers thin noodle-like crisps."
"What is ‘sev’ insurance?","For chickpea flour vermicelli."
"What is ‘gathiya’ insurance?","Protects gujarati fried strips."
"What is ‘fafda’ insurance?","Covers yellow crunchy sticks."
"What is ‘khakra’ insurance?","For thin roasted wheat crackers."
"What is ‘mathri’ insurance?","Protects flaky savory biscuits."
"What is ‘papad’ insurance?","Covers lentil wafer drying."
"What is ‘vadi’ insurance?","For sun-dried lentil dumplings."
"What is ‘pickle jar’ insurance?","Protects mango/lime brine aging."
"What is ‘chutney’ insurance?","Covers coconut/coriander grinding."
"What is ‘achaar’ insurance?","For north indian oil-based pickles."
"What is ‘thokku’ insurance?","Protects south indian paste preserves."
"What is ‘pachadi’ insurance?","Covers yogurt-based vegetable sides."
"What is ‘raita’ insurance?","For cucumber/yogurt condiment."
"What is ‘podimas’ insurance?","Protects grated coconut seasoning."
"What is ‘poriyal’ insurance?","Covers dry vegetable stir-fry."
"What is ‘kootu’ insurance?","For lentil-vegetable stew."
"What is ‘sambar’ insurance?","Protects tamarind-lentil broth."
"What is ‘rasam’ insurance?","Covers pepper-tomwater digestive."
"What is ‘puliyodarai’ insurance?","For tamarind rice preparation."
"What is ‘lemon rice’ insurance?","Protects turmeric-citrus mixing."
"What is ‘coconut rice’ insurance?","Covers grated kernel tossing."
"What is ‘curd rice’ insurance?","For yogurt-rice tempering."
"What is ‘bisi bele bath’ insurance?","Protects karnataka spicy rice."
"What is ‘pongal’ insurance?","Covers tamil lentil-rice dish."
"What is ‘upma’ insurance?","For semolina vegetable porridge."
"What is ‘poha’ insurance?","Protects flattened rice flakes."
"What is ‘idiyappam’ insurance?","Covers steamed rice noodle nests."
"What is ‘puttu’ insurance?","For layered coconut rice cakes."
"What is ‘appam’ insurance?","Protects lace-like rice pancakes."