Question,Answer
"What is term insurance?","Term insurance is a life insurance policy that provides coverage for a specific period."
"How can I file a claim?","You can file a claim by submitting the necessary documents online or visiting the nearest branch."
"What documents are required for a claim?","You typically need a filled claim form, policy documents, identity proof, and medical/hospital reports."
"Is my policy active?","Please log in to your account on our website or contact customer support to check your policy status."
"Can I change my nominee?","Yes, you can change your nominee by submitting a nominee change request form along with valid ID proof."
"How do I pay my premium online?","You can pay your premium through net banking, credit/debit card, UPI, or our mobile app."
"What is a cashless claim?","A cashless claim allows you to get treatment at network hospitals without paying upfront, subject to policy terms."
"How can I cancel my policy?","To cancel your policy, submit a cancellation request with your policy number and required documents at the nearest branch."
"How do I download my policy document?","Log in to your account on our website and download your policy document under 'My Policies'."
"What is the grace period for premium payment?","Most policies offer a 15-30 day grace period for premium payment, depending on the policy terms."
"Can I revive a lapsed policy?","Yes, a lapsed policy can be revived within a specified period by paying due premiums and submitting health declarations."
"What is a rider in insurance?","A rider is an additional benefit that can be added to your base policy for enhanced coverage."
"Do I get a tax benefit on insurance premiums?","Yes, premiums paid for life and health insurance are eligible for tax deductions under relevant tax laws."
"How do I check my claim status?","You can check your claim status online through our portal or call our customer support."
"Can I port my health insurance policy?","Yes, health insurance portability is allowed between insurers as per IRDAI guidelines."
"What is the waiting period in health insurance?","The waiting period is the time you must wait before certain benefits become available, typically 30 days to 4 years."
"How do I update my contact details?","You can update your contact details by logging into your account or visiting a branch with valid proof."
"What does my policy cover?","Your policy covers various risks as specified in the policy document. Please check the terms and conditions."
"How do I renew my policy?","Policy renewal can be done online through our website, mobile app, or by visiting a branch."
"What happens if I miss my premium payment?","If you miss a premium payment, your policy may lapse after the grace period. Some policies allow reinstatement within a specific timeframe."
Question,Answer
"What is term insurance?","Term insurance is a life insurance policy that provides coverage for a specific period."
"How can I file a claim?","You can file a claim by submitting the necessary documents online or visiting the nearest branch."
"What documents are required for a claim?","You typically need a filled claim form, policy documents, identity proof, and medical/hospital reports."
"Is my policy active?","Please log in to your account on our website or contact customer support to check your policy status."
"Can I change my nominee?","Yes, you can change your nominee by submitting a nominee change request form along with valid ID proof."
"How do I pay my premium online?","You can pay your premium through net banking, credit/debit card, UPI, or our mobile app."
"What is a cashless claim?","A cashless claim allows you to get treatment at network hospitals without paying upfront, subject to policy terms."
"How can I cancel my policy?","To cancel your policy, submit a cancellation request with your policy number and required documents at the nearest branch."
"How do I download my policy document?","Log in to your account on our website and download your policy document under 'My Policies'."
"What is the grace period for premium payment?","Most policies offer a 15-30 day grace period for premium payment, depending on the policy terms."
"Can I revive a lapsed policy?","Yes, a lapsed policy can be revived within a specified period by paying due premiums and submitting health declarations."
"What is a rider in insurance?","A rider is an additional benefit that can be added to your base policy for enhanced coverage."
"Do I get a tax benefit on insurance premiums?","Yes, premiums paid for life and health insurance are eligible for tax deductions under relevant tax laws."
"How do I check my claim status?","You can check your claim status online through our portal or call our customer support."
"Can I port my health insurance policy?","Yes, health insurance portability is allowed between insurers as per IRDAI guidelines."
"What is the waiting period in health insurance?","The waiting period is the time you must wait before certain benefits become available, typically 30 days to 4 years."
"How do I update my contact details?","You can update your contact details by logging into your account or visiting a branch with valid proof."
"What does my policy cover?","Your policy covers various risks as specified in the policy document. Please check the terms and conditions."
"How do I renew my policy?","Policy renewal can be done online through our website, mobile app, or by visiting a branch."
"What happens if I miss my premium payment?","If you miss a premium payment, your policy may lapse after the grace period. Some policies allow reinstatement within a specific timeframe."
"Hello!","Hello! How can I assist you today?"
"How are you?","I'm just a virtual assistant, but I'm here to help! How can I assist you?"
"What is the difference between term insurance and whole life insurance?","Term insurance provides coverage for a specific period, while whole life insurance covers you for your entire life."
"Can I buy an insurance policy online?","Yes, you can buy an insurance policy online through our website."
"What is the claim settlement ratio?","The claim settlement ratio is the percentage of claims settled by an insurance company in a given period."
"Is my insurance policy transferable?","Some policies allow transfer under specific conditions. Please check with customer support."
"What are the exclusions in my policy?","Exclusions vary by policy. Check your policy document for specific exclusions."
"Can I have multiple insurance policies?","Yes, you can have multiple insurance policies from different insurers."
"What is no-claim bonus?","No-claim bonus is a discount given on renewal premiums if no claims were made during the policy term."
"What is a deductible in insurance?","A deductible is the amount you pay out-of-pocket before your insurance starts covering expenses."
"How do I contact customer support?","You can contact customer support through our helpline, email, or chat support on our website."
"What are the different types of insurance policies?","Common types include life insurance, health insurance, motor insurance, and home insurance."
"What is a policy endorsement?","A policy endorsement is a modification to your existing insurance policy."
"Can I cancel my health insurance policy anytime?","Yes, but cancellation terms depend on your policy and insurer."
"How long does it take to settle a claim?","Claim settlement time varies by case, typically ranging from a few days to a few weeks."
"What are the benefits of online insurance?","Online insurance offers convenience, lower premiums, and easy access to policy details."
"Do I need medical tests for insurance?","Some policies require medical tests, while others offer coverage without medical exams."
"What is a group insurance policy?","Group insurance provides coverage to multiple individuals under a single policy, typically offered by employers."
"Can I convert my term policy into a permanent policy?","Some term policies offer a conversion option. Check with your insurer."
"What is insurance underwriting?","Underwriting is the process where insurers evaluate risk before issuing a policy."
"What is co-payment in health insurance?","Co-payment is the percentage of medical expenses you pay out-of-pocket before the insurer covers the rest."
"Can I increase my sum insured?","Yes, many policies allow you to increase coverage at renewal."
"What happens if my policy lapses?","A lapsed policy loses its benefits but may be revived within a specific period."
"What is ULIP?","ULIP (Unit Linked Insurance Plan) is a combination of insurance and investment."
"Do I need to nominate a beneficiary?","Yes, nominating a beneficiary ensures that your insurance benefits go to the right person."
"How do I update my nominee details?","You can update nominee details through the insurer’s website or by visiting a branch."
"What are pre-existing diseases in health insurance?","Pre-existing diseases are medical conditions you had before buying the policy. Coverage depends on policy terms."
"What is a maturity benefit?","Maturity benefit is the amount paid by the insurer when a policy term ends."
"How do I switch insurance providers?","You can switch providers under portability rules set by IRDAI."
"What is an insurance premium?","A premium is the amount you pay for your insurance coverage."
"Can I change my policy tenure?","Some policies allow tenure modification. Check with your insurer."
"How do I know which policy is best for me?","Compare policies based on coverage, benefits, and premium to find the best fit."
"What is a network hospital?","A network hospital is a hospital tied up with your insurer for cashless treatments."
"Does my policy cover COVID-19?","Most health insurance policies now include COVID-19 coverage. Check your policy details."
"What is personal accident insurance?","Personal accident insurance covers injuries, disabilities, or death due to accidents."
"What are the benefits of a floater policy?","A floater policy covers multiple family members under a single sum insured."
"Can I get insurance if I have a critical illness?","Yes, but premiums and terms may vary based on medical history."
"What is term insurance?","Term insurance is a life insurance policy that provides coverage for a specific period."
"How can I file a claim?","You can file a claim by submitting the necessary documents online or visiting the nearest branch."
"What documents are required for a claim?","You typically need a filled claim form, policy documents, identity proof, and medical/hospital reports."
"Is my policy active?","Please log in to your account on our website or contact customer support to check your policy status."
"Can I change my nominee?","Yes, you can change your nominee by submitting a nominee change request form along with valid ID proof."
"How do I pay my premium online?","You can pay your premium through net banking, credit/debit card, UPI, or our mobile app."
"What is a cashless claim?","A cashless claim allows you to get treatment at network hospitals without paying upfront, subject to policy terms."
"How can I cancel my policy?","To cancel your policy, submit a cancellation request with your policy number and required documents at the nearest branch."
"How do I download my policy document?","Log in to your account on our website and download your policy document under 'My Policies'."
"What is the grace period for premium payment?","Most policies offer a 15-30 day grace period for premium payment, depending on the policy terms."
"Can I revive a lapsed policy?","Yes, a lapsed policy can be revived within a specified period by paying due premiums and submitting health declarations."
"What is a rider in insurance?","A rider is an additional benefit that can be added to your base policy for enhanced coverage."
"Do I get a tax benefit on insurance premiums?","Yes, premiums paid for life and health insurance are eligible for tax deductions under relevant tax laws."
"How do I check my claim status?","You can check your claim status online through our portal or call our customer support."
"Can I port my health insurance policy?","Yes, health insurance portability is allowed between insurers as per IRDAI guidelines."
"What is the waiting period in health insurance?","The waiting period is the time you must wait before certain benefits become available, typically 30 days to 4 years."
"How do I update my contact details?","You can update your contact details by logging into your account or visiting a branch with valid proof."
"What does my policy cover?","Your policy covers various risks as specified in the policy document. Please check the terms and conditions."
"How do I renew my policy?","Policy renewal can be done online through our website, mobile app, or by visiting a branch."
"What happens if I miss my premium payment?","If you miss a premium payment, your policy may lapse after the grace period. Some policies allow reinstatement within a specific timeframe."
"What is whole life insurance?","Whole life insurance provides lifelong coverage with a savings component called 'cash value' that grows over time."
"What is endowment insurance?","Endowment insurance combines life coverage with savings, paying a lump sum after a fixed term or on death."
"What is critical illness insurance?","It pays a lump sum upon diagnosis of specific illnesses (e.g., cancer, stroke) to cover treatment costs."
"What is travel insurance?","Travel insurance covers trip cancellations, medical emergencies, lost baggage, and other travel-related risks."
"What is home insurance?","Home insurance protects against damages to your property due to fire, theft, natural disasters, etc."
"What is motor insurance?","Motor insurance covers financial losses due to accidents, theft, or third-party liabilities for your vehicle."
"What is a no-claim bonus (NCB)?","NCB is a discount on renewal premiums if no claims were made in the previous policy term."
"What is a surrender value?","The amount refunded if you terminate a policy before maturity (applicable to endowment/whole life plans)."
"What is a free-look period?","A 15-30 day window after policy purchase to review terms and cancel for a full refund if dissatisfied."
"What is a premium waiver rider?","A rider that waives future premiums if the policyholder becomes disabled or critically ill."
"What is a pre-existing disease (PED)?","A medical condition diagnosed before buying the policy, usually covered after a waiting period (1-4 years)."
"What is daycare treatment coverage?","Covers medical procedures (e.g., cataract surgery) requiring less than 24-hour hospitalization."
"What is a co-payment clause?","A fixed percentage (e.g., 10-20%) of hospital bills you must pay, with the insurer covering the rest."
"What is a cumulative bonus?","An increase in sum insured (usually 5-10% per year) for every claim-free year."
"Does health insurance cover maternity?","Some policies cover maternity after a 2-4 year waiting period. Check your policy terms."
"What is a network hospital?","Hospitals tied to your insurer for cashless treatment. Check our website for the list."
"What is a deductible in health insurance?","The fixed amount you pay before the insurer covers expenses (e.g., ₹5,000 per claim)."
"Can I cover my parents under my health policy?","Yes, via a family floater or separate senior citizen policy, subject to terms."
"What is OPD coverage?","Covers outpatient expenses (e.g., doctor consultations, diagnostics) if included in your policy."
"What is a super top-up plan?","It covers expenses exceeding a threshold (e.g., ₹5 lakh) after exhausting base policy limits."
"What is the difference between ULIP and traditional plans?","ULIPs combine insurance + investment, while traditional plans offer fixed returns."
"How are ULIP returns calculated?","Returns depend on market-linked fund performance (equity/debt) chosen by you."
"What is a systematic withdrawal plan (SWP) in ULIPs?","Allows partial withdrawals from your ULIP fund value at regular intervals."
"Can I switch ULIP funds?","Yes, most insurers allow switching between equity/debt funds based on your risk appetite."
"What is a guaranteed surrender value?","The minimum amount refunded if you surrender a policy after 3+ years (varies by plan)."
"What is an annuity plan?","Provides regular income (monthly/quarterly) after retirement in exchange for a lump sum or premiums."
"What is a child insurance plan?","Combines life coverage + savings for a child’s future needs (e.g., education, marriage)."
"What is a money-back policy?","Pays periodic survival benefits during the policy term + lump sum at maturity."
"What is an accidental death benefit rider?","Pays an extra sum (on top of base coverage) if death occurs due to an accident."
"What is a terminal illness rider?","Allows early payout of a portion of the sum insured if diagnosed with a terminal illness."
"What is a hospital cash rider?","Pays a fixed daily amount for each day of hospitalization, regardless of bills."
"What is a critical illness rider?","Pays a lump sum on diagnosis of specific illnesses (e.g., kidney failure, major burns)."
"How do I calculate the sum insured needed?","Consider liabilities (loans), income replacement, and future expenses (e.g., child’s education)."
"What is the ‘human life value’ concept?","Calculates insurance need based on your income, expenses, and dependents’ future needs."
"Can I take a loan against my policy?","Yes, endowment/ULIP/whole life policies allow loans (up to 80-90% of surrender value)."
"How do I check my policy’s fund value (for ULIPs)?","Log in to your online account or check the annual statement sent by the insurer."
"What is an insurance ombudsman?","A grievance redressal authority for disputes with insurers. Contact details are on IRDAI’s website."
"What is IRDAI?","Insurance Regulatory and Development Authority of India—governs insurance companies in India."
"Can I buy insurance without an agent?","Yes, policies can be bought directly online or through insurer websites."
"What is an instant policy?","Policies issued immediately (e.g., term plans) without medical tests for low coverage amounts."
"What is a medical underwriter?","A professional who assesses health risks before approving your policy."
"What is a proposal form?","A form filled during policy purchase with personal, health, and nominee details."
"What is a policy bond?","The legal document outlining your policy’s terms, conditions, and benefits."
"What is a lapse in policy?","When premiums are unpaid beyond the grace period, leading to loss of benefits."
"What is reinstatement?","Reviving a lapsed policy by paying overdue premiums + interest, subject to terms."
"What is a moratorium period?","In health insurance, after 8 years of continuous coverage, no claims can be denied (except fraud)."
"What is AYUSH treatment coverage?","Covers Ayurveda, Yoga, Unani, Siddha, and Homeopathy treatments if hospitalized."
"What is a restoration benefit?","Reinstates the sum insured (once per year) if exhausted during a claim."
"What is a bariatric surgery cover?","Covers weight-loss surgery in some policies, usually after a waiting period."
"What is a domiciliary hospitalization?","Covers treatment at home if hospitalization isn’t possible but meets policy criteria."
"What is a non-network hospital claim?","You pay bills first and later get reimbursed after submitting documents."
"What is a third-party administrator (TPA)?","An intermediary that processes health claims on behalf of insurers."
"How do I port my car insurance?","Submit a request to the new insurer 60 days before renewal; they’ll handle the switch."
"What is zero depreciation cover?","Motor add-on that covers full claim amount without deducting for depreciation of parts."
"What is an engine protector add-on?","Covers engine damage due to water ingression or oil leakage (excluded in basic policies)."
"What is a consumables cover?","Covers items like nuts, bolts, and fluids in health/motor claims (usually excluded)."
"What is a personal accident cover?","Pays for injuries/death due to accidents, separate from life insurance."
"What is key person insurance?","A policy taken by businesses to cover financial loss if a key employee dies."
"What is a group term insurance?","Employer-provided life coverage for employees, usually for 1-3x annual salary."
"What is a top-up health plan?","Additional coverage that kicks in after exhausting the base policy’s sum insured."
"What is a daily hospital cash benefit?","Pays a fixed amount (e.g., ₹2,000/day) for each day of hospitalization."
"What is a global coverage option?","Health add-on for treatment abroad, subject to limits and terms."
"What is a wellness benefit?","Rewards (e.g., gym discounts) for maintaining health, offered by some insurers."
"What is a telemedicine benefit?","Free doctor consultations via phone/video, included in some health policies."
"What is a second opinion benefit?","Coverage for consulting another specialist to confirm a diagnosis."
"What is a home healthcare benefit?","Covers nursing or physiotherapy at home post-hospitalization."
"What is a pet insurance?","Covers veterinary expenses for pets (rare in India, offered by few insurers)."
"What is cyber insurance?","Covers financial losses due to cybercrime (e.g., phishing, data breaches)."
"What is gadget insurance?","Covers repair/replacement of phones/laptops against damage or theft."
"What is travel insurance for Schengen visa?","Mandatory policy for Schengen countries with €30,000+ medical coverage."
"What is an annual multi-trip policy?","Single travel policy covering unlimited trips in a year (within specified durations)."
"What is missed departure cover?","Reimburses extra costs if you miss a flight due to delays (included in travel policies)."
"What is lost baggage cover?","Compensates for baggage delayed/lost by airlines (typically up to ₹50,000)."
"What is adventure sports cover?","Add-on for risky activities (e.g., scuba diving, skiing) in travel policies."
"What is rental car excess cover?","Pays the deductible if a rented car is damaged/stolen (in travel insurance)."
"What is third-party liability in travel insurance?","Covers legal costs if you accidentally injure someone/damage property abroad."
"What is terrorism cover?","Compensates for cancellations/injuries due to terrorist acts (in travel policies)."
"What is a home content insurance?","Covers furniture, electronics, and valuables against theft/damage at home."
"What is a home structure insurance?","Covers the physical building (walls, roof) against fire, earthquakes, etc."
"What is renters’ insurance?","Covers tenants’ belongings and liability (not the building itself)."
"What is jewelry insurance?","Add-on to home policies for high-value items like gold/diamonds (requires valuation)."
"What is an inflation guard clause?","Auto-adjusts home insurance sum insured yearly to account for inflation."
"What is a reinstatement clause?","Pays to rebuild your home to its original state (not just market value)."
"What is public liability cover?","Covers legal costs if someone is injured on your property (e.g., a guest slips)."
"What is professional indemnity insurance?","Covers legal costs if a client sues for errors in your professional services."
"What is directors and officers (D&O) insurance?","Protects company leaders from personal losses due to lawsuits."
"What is marine cargo insurance?","Covers goods during transit by ship/air/road against damage or loss."
"What is business interruption insurance?","Compensates for lost income if operations halt due to covered risks (e.g., fire)."
"What is workmen’s compensation insurance?","Mandatory for employers to cover employee injuries/deaths at work."
"What is fidelity guarantee insurance?","Covers losses due to employee fraud/theft (e.g., embezzlement)."
"What is product liability insurance?","Covers lawsuits if your product causes harm (e.g., food poisoning)."
"What is an insurance aggregator?","A platform (e.g., Policybazaar) to compare/buy policies from multiple insurers."
"What is an insurtech company?","Startups using tech (AI, blockchain) to simplify insurance processes."
"What is a Bancassurance model?","Banks selling insurance products as corporate agents for insurers."
"What is underinsured risk?","When sum insured is less than actual value (e.g., ₹5L for a ₹10L home)."
"What is overinsurance?","Paying for coverage exceeding actual risk (e.g., ₹2Cr term insurance with no liabilities)."
"What is subrogation in insurance?","Insurer’s right to recover claim costs from a third party at fault (e.g., a negligent driver)."
"What is a non-disclosure penalty?","Claim rejection if you hide pre-existing conditions or misrepresent facts."
"What is a ‘act of God’ clause?","Excludes natural disasters (e.g., floods, earthquakes) unless specifically covered."
"What is a ‘named perils’ policy?","Covers only risks explicitly listed (e.g., fire, theft), not all damages."
"What is an ‘all-risk’ policy?","Covers all damages except those explicitly excluded (broader than named perils)."
"What is a first-party claim?","Claim for your own losses (e.g., car repairs after an accident you caused)."
"What is a third-party claim?","Claim against someone else’s policy (e.g., suing a driver who hit your car)."
"What is a ‘no-fault’ claim?","Insurer pays your claim regardless of who caused the accident (e.g., in some motor policies)."
"What is a ‘deductible buy-back’ add-on?","Reduces/eliminates your deductible for an extra premium."
"What is a ‘premium loading’?","Higher charges due to risk factors (e.g., smoking, hazardous occupation)."
"What is a ‘cooling-off period’?","Timeframe (e.g., 30 days) to cancel a policy after purchase for a full refund."
